{
  "schema_version": "2.1",
  "profile_id": "codeindex.cpp@2.1",
  "ordering": "lex",
  "generated_at": "2026-01-16T00:00:00Z",
  "files": [
    { "file_id": "cpp_basic.cpp", "lines": 0, "bytes": 0, "sha256": "REPLACE_ME" }
  ],
  "symbols": [
    { "identifier": "cout", "occurrences": [{ "file_id": "cpp_basic.cpp", "line": 7, "col_start": 8, "col_end": 12 }], "stats": { "occurrence_count": 1, "unique_line_count": 1 } },
    { "identifier": "endl", "occurrences": [{ "file_id": "cpp_basic.cpp", "line": 7, "col_start": 40, "col_end": 44 }], "stats": { "occurrence_count": 1, "unique_line_count": 1 } },
    { "identifier": "iostream", "occurrences": [{ "file_id": "cpp_basic.cpp", "line": 1, "col_start": 11, "col_end": 19 }], "stats": { "occurrence_count": 1, "unique_line_count": 1 } },
    { "identifier": "m", "occurrences": [
        { "file_id": "cpp_basic.cpp", "line": 6, "col_start": 7, "col_end": 8 },
        { "file_id": "cpp_basic.cpp", "line": 7, "col_start": 35, "col_end": 36 }
      ], "stats": { "occurrence_count": 2, "unique_line_count": 2 } },
    { "identifier": "main", "occurrences": [{ "file_id": "cpp_basic.cpp", "line": 4, "col_start": 5, "col_end": 9 }], "stats": { "occurrence_count": 1, "unique_line_count": 1 } },
    { "identifier": "max2", "occurrences": [
        { "file_id": "cpp_basic.cpp", "line": 3, "col_start": 5, "col_end": 9 },
        { "file_id": "cpp_basic.cpp", "line": 6, "col_start": 11, "col_end": 15 }
      ], "stats": { "occurrence_count": 2, "unique_line_count": 2 } },
    { "identifier": "std", "occurrences": [
        { "file_id": "cpp_basic.cpp", "line": 2, "col_start": 21, "col_end": 24 },
        { "file_id": "cpp_basic.cpp", "line": 6, "col_start": 3, "col_end": 6 },
        { "file_id": "cpp_basic.cpp", "line": 7, "col_start": 3, "col_end": 6 },
        { "file_id": "cpp_basic.cpp", "line": 7, "col_start": 26, "col_end": 29 }
      ], "stats": { "occurrence_count": 4, "unique_line_count": 3 } },
    { "identifier": "value", "occurrences": [
        { "file_id": "cpp_basic.cpp", "line": 5, "col_start": 7, "col_end": 12 },
        { "file_id": "cpp_basic.cpp", "line": 6, "col_start": 16, "col_end": 21 }
      ], "stats": { "occurrence_count": 2, "unique_line_count": 2 } }
  ],
  "diagnostics": []
}
